deck,team,tier,copies,card_name,category,realm,color,phase,cost,attack_value,defense_value,game_text,flavor_text,learning_note,rarity,status
Small Org Defense,Blue Team,Small Org,1,Well,Asset,Infrastructure,Green,Reinforce,1,,3,"Generates 1 Infrastructure resource each turn. If destroyed, Blue Team loses 1 SCP.","The smallest source can become the most important asset.","Wells are critical physical assets that should be included in cyber and operational risk planning.",Common,Draft
Small Org Defense,Blue Team,Small Org,1,Water Tower,Asset,Infrastructure,Green,Reinforce,2,,5,"Scenario Asset: if this survives through turn 6, Blue Team gains 2 SCP.","Public pressure rises when the tower is at risk.","Water storage assets connect cyber events to visible community impact.",Rare,Draft
Small Org Defense,Blue Team,Small Org,1,Pump Station,Asset,Infrastructure,Green,Recover,2,,4,"Once per turn, move 1 Defense from this Asset to another Infrastructure Asset.","Flow control is resilience in motion.","Pump stations are operational choke points and should be protected as critical assets.",Uncommon,Draft
Small Org Defense,Blue Team,Small Org,1,Chlorination Unit,Asset,Infrastructure,Green,Reinforce,2,,4,"If damaged by an Attack, discard 1 card unless Field Technician or Infrastructure Engineer is active.","Safety depends on more than uptime.","Chemical treatment systems require strong monitoring because integrity failures can affect safety.",Rare,Draft
Small Org Defense,Blue Team,Small Org,1,RTU or PLC,Asset,Infrastructure,Green,Reinforce,1,,3,"Protocol cards attached to this Asset cost 1 less to play.","Small controllers carry big consequences.","RTUs and PLCs bridge cyber systems and physical operations in ICS environments.",Common,Draft
Small Org Defense,Blue Team,Small Org,1,Gateway,Asset,Network,Black,Detect/Reinforce,1,,3,"The first Internet Attack against this Asset each game deals 1 less damage.","Every path in needs a guardrail.","Gateways and remote access paths should be monitored and hardened.",Common,Draft
Small Org Defense,Blue Team,Small Org,1,Operator Laptop,Asset,Endpoint,Red,Respond,1,,2,"If an Operator is active, this Asset gains +1 Defense.","The laptop is small. The access is not.","Operator endpoints often become high-value targets because they touch operational systems.",Common,Draft
Small Org Defense,Blue Team,Small Org,1,Basic Firewall,Asset,Network,Black,Reinforce,2,,4,"Internet Attacks cost Red Team 1 additional resource while this Asset is active.","A basic wall is still a wall.","Even simple perimeter controls can reduce opportunistic attacks when configured properly.",Uncommon,Draft
Small Org Defense,Blue Team,Small Org,1,SCADA Web Interface,Asset,Application,White/Grey,Detect,2,,3,"If revealed by Recon, Red Team may draw 1 card unless MFA is active.","A useful dashboard can become a useful target.","Exposed SCADA interfaces increase risk when authentication and access control are weak.",Uncommon,Draft
Small Org Defense,Blue Team,Small Org,1,Password Reset,Defense,Endpoint,Red,Respond/Recover,1,,2,"Cancel one Credential Attack or restore 2 Defense to one Operator or Endpoint Asset.","Regaining control starts with the account.","Account recovery is part of containment when credentials are suspected to be compromised.",Common,Draft
Small Org Defense,Blue Team,Small Org,1,MFA,Defense,Internet,Blue,Reinforce,2,,3,"Cancel the bonus effect of one Credential or Remote Access Attack. Reduce that Attack damage by 1.","One extra step can close an easy door.","MFA helps reduce risk from guessed, reused, or stolen credentials.",Uncommon,Draft
Small Org Defense,Blue Team,Small Org,1,Vendor Support Contract,Defense,Infrastructure,Green,Recover,2,,2,"Restore 2 Defense to one damaged Infrastructure Asset. If Gateway is active, draw 1 card.","Help is valuable when the access is controlled.","Vendor support can aid recovery but should be governed and reviewed.",Uncommon,Draft
Small Org Defense,Blue Team,Small Org,1,Port Closure,Defense,Network,Black,Respond/Reinforce,1,,2,"Cancel one Recon card or reduce one Network Attack by 2 damage.","Closed ports tell fewer stories.","Reducing unnecessary exposed services limits attacker options.",Common,Draft
Small Org Defense,Blue Team,Small Org,1,Port Scanner,Tool,Network,Black,Detect,1,,,"Reveal one face-down or unrevealed Red Team card. If it is Recon, draw 1 card.","Defenders can scan too.","Authorized scanning helps validate exposure and find services before attackers do.",Common,Draft
Small Org Defense,Blue Team,Small Org,1,Deep Packet ICS Monitor,Tool,Infrastructure,Green,Detect,3,,,"Look at the top 3 Red Team cards. You may discard one Attack or Command card that targets Infrastructure.","The packet tells the story before the process does.","ICS-aware monitoring helps identify suspicious protocol behavior and operational anomalies.",Rare,Draft
Small Org Defense,Blue Team,Small Org,1,Antivirus,Tool,Endpoint,Red,Respond/Recover,1,,,"Remove one Malware or Remote Access Tool effect from an Endpoint Asset or reduce Malware damage by 2.","Basic protection is better than wishful thinking.","Endpoint protection can reduce common malware risk but should not be the only control.",Common,Draft
Small Org Defense,Blue Team,Small Org,1,Modbus Protocol,Protocol,Infrastructure,Green,Reinforce,1,,1,"Attach to RTU or PLC. That Asset gains +1 Defense but takes +1 damage from Recon-followed Attacks.","Simple protocols need careful boundaries.","Legacy ICS protocols may lack modern security features and require compensating controls.",Common,Draft
Small Org Defense,Blue Team,Small Org,1,Port 23,Protocol,Network,Black,Reinforce,0,,1,"Legacy risk: while active, Remote Terminal Protocol costs 0. Red Team Attacks against this card deal +1 damage.","The old door is still a door.","Legacy services should be removed, restricted, or monitored because they create avoidable exposure.",Common,Draft
Small Org Defense,Blue Team,Small Org,1,Remote Terminal Protocol,Protocol,Internet,Blue,Reinforce,0,,1,"Attach to a Legacy Asset. Red Team Credential Attacks against that Asset deal +1 damage.","Convenience aged into risk.","Insecure remote protocols should not be exposed and should be replaced with safer alternatives.",Common,Draft
Small Org Defense,Blue Team,Small Org,1,Port 80,Protocol,Network,Black,Reinforce,0,,1,"If attached to SCADA Web Interface, Public Info Gathering or Network Scan reveals that Asset automatically.","Plain access makes plain targets.","Unencrypted or exposed web services can reveal sensitive operational surfaces.",Common,Draft
Small Org Defense,Blue Team,Small Org,1,Plain Web Protocol,Protocol,Internet,Blue,Reinforce,0,,1,"Attach to an Application Asset. That Asset costs 1 less to play but takes +1 damage from Internet Attacks.","Easy access has a cost.","Plain web access can create visibility and integrity risks when used for sensitive systems.",Common,Draft
Small Org Defense,Blue Team,Small Org,1,IT Admin,Operator,Network,Black,Respond,2,,3,"Once per turn, reduce Network Attack damage by 1.","Someone has to know where the cables go.","IT administrators support segmentation, account control, and response during incidents.",Uncommon,Draft
Small Org Defense,Blue Team,Small Org,1,Field Technician,Operator,Infrastructure,Green,Recover,1,,2,"Restore 1 Defense to one Infrastructure Asset each turn.","Boots on the ground keep water moving.","Field staff are essential to physical validation and manual recovery during cyber incidents.",Common,Draft
Small Org Defense,Blue Team,Small Org,1,Infrastructure Engineer,Operator,Infrastructure,Green,Recover/Reinforce,3,,4,"When you play a Protocol card, restore 1 Defense to one Infrastructure Asset.","Design matters most when things break.","Engineering knowledge helps defenders understand dependencies and safe restoration steps.",Rare,Draft
Small Org Defense,Blue Team,Small Org,6,Operations Budget,Realm,Infrastructure,Green,Reinforce,0,,,"Provides 1 Infrastructure resource.","Keeping the lights on is a strategy.","Operations funding supports routine maintenance and daily resilience.",Common,Draft
Small Org Defense,Blue Team,Small Org,1,Capital Funding,Realm,Infrastructure,Green,Reinforce,0,,,"Provides 1 Infrastructure resource. If used for an Asset, that Asset enters with +1 Defense.","Big upgrades start with rare funding.","Capital funding helps replace or improve critical systems.",Uncommon,Draft
Small Org Defense,Blue Team,Small Org,1,Federal Assistance,Realm,Infrastructure,Green,Recover/Reinforce,0,,,"Provides 2 Infrastructure resources for a Defense, Tool, or Recovery card. Discard after use.","Help arrives when preparation meets need.","External funding and assistance can improve recovery and resilience for small utilities.",Rare,Draft
Script Kiddie Attack,Red Team,Script Kiddie,2,Network Scan,Attack,Network,Black,Recon,1,1,,"Reveal up to 2 Blue Team Assets. If Gateway or SCADA Web Interface is revealed, draw 1 card.","The scan came before the splash.","Port scanning helps attackers identify exposed services and reachable systems before exploitation.",Common,Draft
Script Kiddie Attack,Red Team,Script Kiddie,2,Public Info Gathering,Attack,Internet,Blue,Recon,1,1,,"Look at Blue Team's hand. Choose one Asset card from it; Blue Team reveals that card until it is played or discarded.","Public clues become private pressure.","Public information can help attackers understand technology, vendors, staff, and exposed systems.",Common,Draft
Script Kiddie Attack,Red Team,Script Kiddie,2,Downloaded Exploit,Attack,Endpoint,Red,Weaponize/Exploit,2,3,,"Deal 3 damage to one Asset. If Network Scan or Public Info Gathering was played this turn, deal +1 damage.","Copied code still breaks real things.","Low-skill attackers can cause real impact when public exploit code matches exposed systems.",Common,Draft
Script Kiddie Attack,Red Team,Script Kiddie,1,Pre Built Malware Package,Attack,Endpoint,Red,Weaponize/Install,2,2,,"Attach to an Endpoint Asset. At the start of Red Team's turn, that Asset takes 1 damage. Antivirus removes this card.","The package was cheap. The outage was not.","Commodity malware can create recurring impact when endpoint containment is delayed.",Uncommon,Draft
Script Kiddie Attack,Red Team,Script Kiddie,1,Phishing Campaign,Attack,Internet,Blue,Delivery,2,2,,"Disable one Operator until Blue Team's next turn unless Blue Team discards 1 card.","The first click was human.","Phishing often targets staff access and can delay operational response.",Uncommon,Draft
Script Kiddie Attack,Red Team,Script Kiddie,2,Malicious Link,Attack,Internet,Blue,Delivery,1,2,,"Deal 2 damage to Operator Laptop or SCADA Web Interface. If Phishing Campaign was played this game, draw 1 card.","One link moved the incident forward.","Malicious links are common delivery methods for credential theft and malware.",Common,Draft
Script Kiddie Attack,Red Team,Script Kiddie,2,Malicious Attachment,Attack,Endpoint,Red,Delivery/Install,1,2,,"Deal 2 damage to Operator Laptop. If it is damaged, you may play Pre Built Malware Package for 1 less this turn.","The file looked routine until it ran.","Attachments can deliver payloads that affect user workstations and operational access.",Common,Draft
Script Kiddie Attack,Red Team,Script Kiddie,2,Vulnerability Exploit,Attack,Application,White/Grey,Exploit,2,3,,"Deal 3 damage to SCADA Web Interface, Gateway, or RTU or PLC. Port Closure reduces this damage by 2.","The weakness was known before the attack.","Known vulnerabilities become dangerous when systems remain exposed or unpatched.",Common,Draft
Script Kiddie Attack,Red Team,Script Kiddie,2,Credential Attack,Attack,Application,White/Grey,Exploit,2,3,,"Deal 3 damage. MFA cancels this card's damage bonus and reduces damage by 1.","The account became the entry point.","Credential abuse is a common path into remote and operational systems.",Common,Draft
Script Kiddie Attack,Red Team,Script Kiddie,2,Password Spray,Attack,Application,White/Grey,Exploit,2,2,,"Deal 2 damage. If MFA is not active, disable one Operator until Blue Team's next turn.","One weak password can slow a whole team.","Password spraying abuses weak or reused credentials across accounts.",Common,Draft
Script Kiddie Attack,Red Team,Script Kiddie,1,Remote Access Tool,Tool,Endpoint,Red,Install/C2,3,2,,"Attach to Operator Laptop or SCADA Web Interface after it is damaged. Red Team's next Attack against that Asset costs 1 less.","Remote access turned damage into control.","Remote access malware or tooling can help attackers maintain access after initial compromise.",Rare,Draft
Script Kiddie Attack,Red Team,Script Kiddie,1,Command Communication,Asset,Internet,Blue,Command and Control,2,,3,"While active, Red Team may draw 1 card after playing an Install card. Destroy this Asset if Blue Team plays Deep Packet ICS Monitor.","The compromised system called home.","Command channels help attackers manage compromised systems and continue operations.",Uncommon,Draft
Script Kiddie Attack,Red Team,Script Kiddie,1,Command Channel,Asset,Network,Black,Command and Control,2,,3,"Once per turn, reduce the cost of an Attack by 1 if Red Team has damaged an Asset this game.","Control turns access into pressure.","Command channels represent attacker coordination after initial access.",Rare,Draft
Script Kiddie Attack,Red Team,Script Kiddie,1,Backup Command Channel,Asset,Internet,Blue,Command and Control,1,,2,"If Command Communication or Command Channel would be destroyed, destroy this card instead.","One channel failed. Another answered.","Redundant attacker communication paths make containment harder.",Uncommon,Draft
Script Kiddie Attack,Red Team,Script Kiddie,1,System Outage,Event,Infrastructure,Green,Actions on Objectives,4,4,,"Play only if two or more Blue Team Assets are damaged. Blue Team loses 3 SCP. If Water Tower is damaged, Blue Team loses 1 additional SCP.","The cyber event became an operations call.","The most important lesson is how cyber actions create operational consequences.",Legendary,Draft
Script Kiddie Attack,Red Team,Script Kiddie,4,Operations Budget,Realm,Infrastructure,Green,Weaponize,0,,,"Provides 1 resource for Red Team cards.","Even attackers spend resources.","Resources pace the game and prevent every attack from happening at once.",Common,Draft
Script Kiddie Attack,Red Team,Script Kiddie,2,Network Position,Realm,Network,Black,Command and Control,0,,,"Provides 1 Network resource. If used for Command Channel or Remote Access Tool, that card enters with +1 Defense.","Access is easier to keep after a foothold.","Network position represents attacker reach inside or near target systems.",Uncommon,Draft
Script Kiddie Attack,Red Team,Script Kiddie,2,External Access,Realm,Internet,Blue,Delivery,0,,,"Provides 1 Internet resource. If used for Recon or Delivery, draw 1 card then discard 1 card.","The outside path was enough to begin.","External access gives attackers a starting point for reconnaissance and delivery.",Common,Draft
Script Kiddie Attack,Red Team,Script Kiddie,2,App Access,Realm,Application,White/Grey,Exploit,0,,,"Provides 1 Application resource. If used for Credential Attack or Vulnerability Exploit, that Attack deals +1 damage once per game.","The portal became a pressure point.","Application access can turn weak authentication or exposed interfaces into impact.",Uncommon,Draft
